name,image,category,mrp,stock,description,specifications
Product A,https://example.com/img1.jpg,Electronics,1999,20,High-quality wireless earphones with noise cancellation.,Bluetooth 5.0, 20hr battery, Fast charging
Product B,https://example.com/img2.jpg,Fashion,999,50,Comfortable cotton t-shirt suitable for daily wear.,100% Cotton, Regular Fit
Product C,https://example.com/img3.jpg,Home,1499,30,Durable stainless steel water bottle.,1 Liter, Leak-proof, Hot & Cold
Product D,https://example.com/img4.jpg,Sports,799,15,Professional-grade football for training.,Size 5, Waterproof, High Grip
Product E,https://example.com/img5.jpg,Grocery,299,100,Organic premium-quality almonds.,500g pack, Raw, High protein



